entry-title,entry-title href,updated
Trevor Noah: Son of Patricia (2018) – Full Transcript,https://scrapsfromtheloft.com/2018/11/21/trevor-noah-son-of-patricia-transcript/,2018-11-21T22:18:29+00:00
TREVOR NOAH: LIVE AT THE O2 LONDON (2018) – PRINCE HARRY & MEGHAN MARKLE’S ROYAL WEDDING,https://scrapsfromtheloft.com/2018/05/23/trevor-noah-royal-wedding-2018/,2018-05-23T09:23:46+01:00
TREVOR NOAH: LIVE AT THE APOLLO (2013) – Transcript,https://scrapsfromtheloft.com/2018/01/04/trevor-noah-live-at-the-apollo-2013-transcript/,2018-01-04T18:25:47+00:00
TREVOR NOAH: LOST IN TRANSLATION (2015) – Full Transcript,https://scrapsfromtheloft.com/2017/08/12/trevor-noah-lost-translation-2015-full-transcript/,2017-08-12T20:42:31+01:00
TREVOR NOAH: AFRAID OF THE DARK (2017) – Full Transcript,https://scrapsfromtheloft.com/2017/04/22/trevor-noah-afraid-dark-2017-full-transcript/,2017-08-12T19:21:29+01:00